{
  "schema_version": "1.1",
  "kind": "PearlOrgBaseline",
  "baseline_id": "orgb_example_ai_standard_v1",
  "org_name": "Example Enterprise",
  "defaults": {
    "data_privacy": {
      "a001_1_policy_documentation": true,
      "a001_2_data_retention_implementation": true,
      "a001_3_data_subject_right_processes": false,
      "a002_1_output_usage_ownership_policy": true,
      "a003_1_data_collection_scoping": true,
      "a003_2_alerting_for_auth_failures": false,
      "a003_3_authorization_system_integration": false,
      "a004_1_user_guidance_on_confidential_info": true,
      "a004_2_foundational_model_ip_protections": true,
      "a004_3_ip_detection_implementation": false,
      "a004_4_ip_disclosure_monitoring": false,
      "a005_1_consent_for_combined_data": true,
      "a005_2_customer_data_isolation": true,
      "a005_3_privacy_enhancing_controls": false,
      "a006_1_pii_detection_filtering": true,
      "a006_2_pii_access_controls": true,
      "a006_3_dlp_system_integration": false,
      "a007_1_model_provider_ip_protections": true,
      "a007_2_ip_infringement_filtering": false,
      "a007_3_user_facing_ip_notices": false
    },
    "security": {
      "b001_1_adversarial_testing_report": true,
      "b001_2_security_program_integration": false,
      "b002_1_adversarial_input_detection_alerting": false,
      "b002_2_adversarial_incident_response": false,
      "b002_3_detection_config_updates": false,
      "b002_4_preprocessing_adversarial_detection": false,
      "b002_5_ai_security_alerts": false,
      "b003_1_technical_disclosure_guidelines": false,
      "b003_2_public_disclosure_approval_records": false,
      "b004_1_anomalous_usage_detection": true,
      "b004_2_rate_limits": true,
      "b004_3_external_pentest_ai_endpoints": true,
      "b004_4_vulnerability_remediation": true,
      "b005_1_input_filtering": false,
      "b005_2_input_moderation_approach": false,
      "b005_3_warning_for_blocked_inputs": false,
      "b005_4_input_filtering_logs": false,
      "b005_5_input_filter_performance": false,
      "b006_1_agent_service_access_restrictions": true,
      "b006_2_agent_security_monitoring_alerting": true,
      "b007_1_user_access_controls": true,
      "b007_2_access_reviews": true,
      "b008_1_model_access_controls": true,
      "b008_2_api_deployment_security": true,
      "b008_3_model_hosting_security": false,
      "b008_4_model_integrity_verification": false,
      "b009_1_output_volume_limits": true,
      "b009_2_user_output_notices": true,
      "b009_3_output_precision_controls": false
    },
    "safety": {
      "c001_1_risk_taxonomy": true,
      "c001_2_risk_taxonomy_reviews": true,
      "c002_1_pre_deployment_test_approval": true,
      "c002_2_sdlc_integration": true,
      "c002_3_vulnerability_scan_results": true,
      "c003_1_harmful_output_filtering": true,
      "c003_2_guardrails_for_high_risk_advice": true,
      "c003_3_guardrails_for_biased_outputs": false,
      "c003_4_filtering_performance_benchmarks": false,
      "c004_1_out_of_scope_guardrails": true,
      "c004_2_out_of_scope_attempt_logs": true,
      "c004_3_user_guidance_on_scope": false,
      "c005_1_risk_detection_response": true,
      "c005_2_human_review_workflows": true,
      "c005_3_automated_response_mechanisms": true,
      "c006_1_output_sanitization": true,
      "c006_2_warning_labels_untrusted_content": true,
      "c006_3_adversarial_output_detection": false,
      "c007_1_high_risk_criteria_definition": false,
      "c007_2_high_risk_detection_mechanisms": false,
      "c007_3_human_review_for_high_risk": false,
      "c008_1_risk_monitoring_logs": false,
      "c008_2_monitoring_findings_documentation": false,
      "c008_4_security_tooling_integration": false,
      "c009_1_user_intervention_mechanisms": false,
      "c009_2_feedback_intervention_reviews": false,
      "c010_1_harmful_output_testing_report": true,
      "c011_1_outofscope_output_testing_report": true,
      "c012_1_customer_risk_testing_report": true
    },
    "reliability": {
      "d001_1_groundedness_filter": true,
      "d001_2_user_citations_source_attribution": true,
      "d001_3_user_uncertainty_labels": false,
      "d002_1_hallucination_testing_report": true,
      "d003_1_tool_authorization_validation": true,
      "d003_2_rate_limits_for_tools": true,
      "d003_3_tool_call_log": true,
      "d003_4_human_approval_workflows": false,
      "d003_5_tool_call_log_reviews": false,
      "d004_1_tool_call_testing_report": true
    },
    "accountability": {
      "e001_1_security_breach_failure_plan": true,
      "e002_1_harmful_output_failure_plan": true,
      "e002_2_harmful_output_failure_procedures": false,
      "e003_1_hallucination_failure_plan": true,
      "e003_2_hallucination_failure_procedures": true,
      "e004_1_change_approval_policy_records": true,
      "e004_2_code_signing_implementation": true,
      "e005_1_deployment_decisions": true,
      "e006_1_vendor_due_diligence": true,
      "e008_1_internal_review_documentation": true,
      "e008_2_external_feedback_integration": false,
      "e009_1_third_party_access_monitoring": false,
      "e010_1_acceptable_use_policy": true,
      "e010_2_aup_violation_detection": true,
      "e010_3_user_notification_for_aup_breaches": true,
      "e010_4_guardrails_enforcing_acceptable_use": false,
      "e011_1_ai_processing_locations": true,
      "e011_2_data_transfer_compliance": true,
      "e012_1_regulatory_compliance_reviews": true,
      "e013_1_quality_objectives_risk_management": false,
      "e013_2_change_management_procedures": false,
      "e013_3_issue_tracking_monitoring": false,
      "e013_4_data_management_procedures": false,
      "e013_5_stakeholder_communication_procedures": false,
      "e015_1_logging_implementation": true,
      "e015_2_log_storage": true,
      "e015_3_log_integrity_protection": false,
      "e016_1_text_ai_disclosure": true,
      "e016_2_voice_ai_disclosure": true,
      "e016_3_labelling_ai_generated_content": true,
      "e016_4_automation_ai_disclosure": true,
      "e016_5_system_response_to_ai_inquiry": true,
      "e017_1_transparency_policy": false,
      "e017_2_model_cards_system_documentation": false,
      "e017_3_transparency_report_sharing_policy": false
    },
    "society": {
      "f001_1_foundation_model_cyber_capabilities": true,
      "f001_2_cyber_use_detection": true,
      "f002_1_foundation_model_cbrn_capabilities": true,
      "f002_2_catastrophic_misuse_monitoring": false
    }
  },
  "environment_requirements": {
    "sandbox": [
      "accountability.e001_1_security_breach_failure_plan",
      "accountability.e010_1_acceptable_use_policy",
      "safety.c001_1_risk_taxonomy"
    ],
    "dev": [
      "accountability.e001_1_security_breach_failure_plan",
      "accountability.e010_1_acceptable_use_policy",
      "accountability.e010_2_aup_violation_detection",
      "data_privacy.a006_1_pii_detection_filtering",
      "security.b007_1_user_access_controls",
      "safety.c001_1_risk_taxonomy",
      "safety.c002_1_pre_deployment_test_approval"
    ],
    "preprod": [
      "data_privacy.a006_1_pii_detection_filtering",
      "data_privacy.a006_2_pii_access_controls",
      "security.b001_1_adversarial_testing_report",
      "security.b006_1_agent_service_access_restrictions",
      "security.b007_1_user_access_controls",
      "safety.c003_1_harmful_output_filtering",
      "safety.c004_1_out_of_scope_guardrails",
      "safety.c010_1_harmful_output_testing_report",
      "reliability.d001_1_groundedness_filter",
      "reliability.d003_1_tool_authorization_validation",
      "accountability.e002_1_harmful_output_failure_plan",
      "accountability.e016_1_text_ai_disclosure"
    ],
    "prod": [
      "data_privacy.a001_1_policy_documentation",
      "data_privacy.a003_1_data_collection_scoping",
      "data_privacy.a006_1_pii_detection_filtering",
      "security.b001_1_adversarial_testing_report",
      "security.b004_3_external_pentest_ai_endpoints",
      "security.b006_1_agent_service_access_restrictions",
      "safety.c003_1_harmful_output_filtering",
      "safety.c004_1_out_of_scope_guardrails",
      "safety.c010_1_harmful_output_testing_report",
      "reliability.d001_1_groundedness_filter",
      "reliability.d002_1_hallucination_testing_report",
      "reliability.d003_1_tool_authorization_validation",
      "reliability.d004_1_tool_call_testing_report",
      "accountability.e002_1_harmful_output_failure_plan",
      "accountability.e012_1_regulatory_compliance_reviews",
      "accountability.e015_1_logging_implementation",
      "accountability.e016_1_text_ai_disclosure",
      "society.f001_1_foundation_model_cyber_capabilities",
      "society.f002_1_foundation_model_cbrn_capabilities"
    ]
  },
  "environment_defaults": {
    "sandbox": {
      "production_data_allowed": false,
      "approval_level": "minimal"
    },
    "dev": {
      "production_data_allowed": false,
      "approval_level": "standard"
    },
    "preprod": {
      "production_like_controls_required": true,
      "approval_level": "high"
    },
    "prod": {
      "approval_level": "strict",
      "autonomous_actions_default": "limited"
    }
  },
  "integrity": {
    "signed": false
  }
}
